<?xml version="1.0" encoding="UTF-8"?> 
<hospital:Hospital xmlns:hospital="https://mif.vu.lt/"
          xmlns:xsi="http://www.w3.org/2001/XMLSchema-instance"
          xsi:schemaLocation="https://mif.vu.lt/ 2.xsd">
    <Patients>
        <Patient id="50109113325" sex="male">
            <FullName>Vilius Tažauskas</FullName>
            <Birthdate>2001-09-11</Birthdate>
            <MedicalDebt>484.11</MedicalDebt>
            <MedicalHistory>
                <MedicalRecord>
                    <Doctor ref="D000001"/>
                    <Diagnosis>Venezuelan hemorrhagic fever</Diagnosis>
                    <Treatment>
                        <Prescription measure="mg">
                            <Name>Ribavirin</Name>
                            <DoseSize>250</DoseSize>
                            <DosingInterval>Daily</DosingInterval>
                            <Amount>16</Amount>
                        </Prescription>
                    </Treatment>
                    <AdmissionNote>
                        Complains about difficulty breathing. Body temperature at admission 39℃. Patient does not use any visual aids. Upper airway sounds heard diffusely across all lung fields, persistent rattling but non-productive cough exhibited throughout exam.
                    </AdmissionNote>
                </MedicalRecord>
                <MedicalRecord>
                    <Doctor ref="D000014"/>
                    <Diagnosis>Sepsis</Diagnosis>
                    <Treatment>
                        <Prescription measure="g">
                            <Name>Cefepime</Name>
                            <DoseSize>1</DoseSize>
                            <DosingInterval>2 times a day</DosingInterval>
                            <Amount>20</Amount>
                        </Prescription>
                        <Prescription measure="g">
                            <Name>Ceftriaxone</Name>
                            <DoseSize>1</DoseSize>
                            <DosingInterval>3 times a day</DosingInterval>
                            <Amount>30</Amount>
                        </Prescription>
                    </Treatment>
                    <AdmissionNote>
                        Patient admitted thru emergency room with the diagnosis of “Due to concern for sepsis,” from unknown source, broad spectrum antibiotics started.” Vital signs: Temperature 38.5, heart rate 120, blood pressure 166/78, pulse oxygenation 92%.
                    </AdmissionNote>
                </MedicalRecord>
            </MedicalHistory>
        </Patient>
        <Patient id="61101112212" sex="female">
            <FullName>Gintautė Rimšelytė</FullName>
            <Birthdate>2011-01-11</Birthdate>
            <MedicalDebt>0</MedicalDebt>
            <MedicalHistory />
        </Patient>
        <Patient id="48504211758" sex="female">
            <FullName>Ieva Ginaitė</FullName>
            <Birthdate>1985-04-21</Birthdate>
            <MedicalDebt>18400.74</MedicalDebt>
            <MedicalHistory>
                <MedicalRecord>
                    <Doctor ref="D004744"/>
                    <Diagnosis>Lymphoma</Diagnosis>
                    <Treatment>
                        <Prescription measure="mg">
                            <Name>Altretamine</Name>
                            <DoseSize>260</DoseSize>
                            <DosingInterval>Daily</DosingInterval>
                            <Amount>28</Amount>
                        </Prescription>
                        <Prescription measure="mg">
                            <Name>Chlorambucil</Name>
                            <DoseSize>2</DoseSize>
                            <DosingInterval>Daily</DosingInterval>
                            <Amount>60</Amount>
                        </Prescription>
                        <Prescription measure="mg">
                            <Name>Trabectedin</Name>
                            <DoseSize>2</DoseSize>
                            <DosingInterval>Every 8 hours</DosingInterval>
                            <Amount>80</Amount>
                        </Prescription>
                    </Treatment>
                    <AdmissionNote>
                        Patient came to ER, was vomiting blood; lymphocyte 78%, rbc 2.74.
                    </AdmissionNote>
                </MedicalRecord>
            </MedicalHistory>
        </Patient>
    </Patients>
    <Employees>
        <Doctor id="D000001">
            <FullName>Faustas Mažeikis</FullName>
            <PhoneNumber>+37061417844</PhoneNumber>
            <Speciality license="MPL-10931">Diagnostician</Speciality>
            <Department>Diagnostics</Department>
        </Doctor>
        <Doctor id="D000002">
            <FullName>Joana Irisa</FullName>
            <PhoneNumber>+37065729345</PhoneNumber>
            <Speciality license="MPL-14274">Neurosurgeon</Speciality>
            <Department>Surgery</Department>
        </Doctor>
        <Doctor id="D000014">
            <FullName>Karolina Marmeladova</FullName>
            <PhoneNumber>+37062021441</PhoneNumber>
            <Speciality license="MPL-19238">General Practitioner</Speciality>
            <Department>Family Medicine</Department>
        </Doctor>
        <Doctor id="D004744">
            <FullName>Viljemas Baltasis</FullName>
            <PhoneNumber>+37067777777</PhoneNumber>
            <Speciality license="MPL-20121">Oncologist</Speciality>
            <Department>Oncology</Department>
        </Doctor>
        <Resident id="D004001">
            <FullName>Ueli Freinshmacth</FullName>
            <PhoneNumber>+37067777788</PhoneNumber>
            <Speciality license="MPL-20021">Diagnostician</Speciality>
            <Department>Diagnostics</Department>
        </Resident>
    </Employees>
</hospital:Hospital>